We start with the headline and then flesh out the story , as opposed to The New York Times , which writes the issue and then has a headline editor to make it snappy .	flesh	7	Pres
Our project of a Europe that aims to satisfy social needs envisages the convergence of living conditions towards the highest common denominator .	envisages	11	Pres
Even he ca n't believe that he is trotting out this old saw again .	trotting	8	Pres
I recommend to you , even though most of you do not understand Arabic , to watch Al Jazeera , from time to time .	recommend	1	Pres
How to avoid problems caused by mixing queries under different ANSI SQL query modes in the same database	mixing	6	Pres
Oh , it is dueled out through one catalytic converter with Flow Masters to accent the sound .	dueled	4	Past
Then he rounded on Harry .	rounded	2	Past
To make the reference more pointed and unmistakable , Sir Nathaniel replies " a most singular & choice epithet , " and at once enters it in his note book .	replies	11	Pres
IT S NOT A BIG DEAL BUT I HAD TO TAKE MY SALAD HOME BECAUSE THEY FORGOT TO BRING IT .	HAD	8	Past
What power curve are we valuing the deal against - PJM East or West Hub ?	valuing	5	Pres
Such controls will be left unbound on a page .	unbound	5	Past
brought dog home and it s all choppy now !	brought	0	Past
IN MY OPINION SHOULD OF JUST TOOK OFF THE PRICE OF THE WINGS FROM THE BILL .	TOOK	6	Past
I know that if my garage door needs to be repaired , I will be calling A CLASS Garage Doors	repaired	10	Past
The sun blazed overhead , burning the back of his neck .	blazed	2	Past
The George Washington Bridge can be crossed by bicycle or on foot as well as in a motorized vehicle .	motorized	17	Past
They are kind of in rank order but as I stated if I find the piece that I like we will purchase it .	stated	10	Past
Rachel snorted .	snorted	1	Past
The paint becomes exhausted , the city encroaches with its soot , the plaster crumbles within .	crumbles	14	Pres
OK , I digress .	digress	3	Pres
When you create a Microsoft Access database , you need to decide which query mode you are going to use , because mixing queries created in both query modes could produce runtime errors or unexpected results .	mixing	22	Pres
What 's happening ?	happening	2	Pres
In the same way , he chose the three others to play the roles he destined for them .	destined	15	Past
According to a report prepared by a committee of Arab intellectuals and published under the auspices of the U.N. , the number of books translated by the entire Arab world is much smaller than what little Greece alone translates .	prepared	4	Past
People have been fleeing this country at roughly a plane load per week for the past 20 + years , so it 's not anything new .	fleeing	3	Pres
Notice Regarding Privacy and Confidentiality : PaineWebber reserves the right to monitor and review the content of all e-mail communications sent and / or received by its employees .	reserves	7	Pres
Both bathrooms look like they were flooded and the wood cabinets are thrashed at the bottom and they slapped some pieces of wood over to try to cover it up .	slapped	18	Past
He was so accustomed to effacing himself in the hours of discussion of constitutional law and political tactics ( a white man , an outsider offering impersonal service for whatever it was worth ) ...	effacing	5	Pres
Using molecular genetic - engineering techniques , the British company Oxitec has created a new way to control the mosquito species that transmits dengue fever .	transmits	22	Pres
How FusionRetail has overcome these issues ?	overcome	3	Past
Consider basing some of your words from other words you have invented .	invented	11	Past
" Beijing may end up in a early 1990s Japan situation , where it is forced to sell recently purchased overseas assets for a fraction of what it paid for them . "	purchased	19	Past
Thought you 'd like to know that the Dixie Chicks are coming back to Houston Dec. 12 and will performing just down the street from you at the Compaq Center ... it 's all about you and your needs .	performing	19	Pres
I swear that he might have twisted it off had I understood what it would mean to Garcia .	swear	1	Pres
" He 's hanging out with the celebrities , and has kind of become the same sort of celebrity he was interested in documenting earlier in his career " , Wilkins said .	hanging	3	Pres
Harry dashed around his room , collecting his things together and passing them out of the window to Ron .	dashed	1	Past
The Ten Degree Channel divides the Andamans , which are the larger and more heavily populated northern islands , from the 20 or so Nicobar Islands in the south .	divides	4	Pres
Pewter is perfect for what you are doing , and it melts on a stove top .	melts	11	Pres
The city reasoned , " because the users of the private schools pay a frequency fee , this kind of activity is considered as a commercial one " ( ( it ) ) .	pay	12	Pres
As i asked in the previous questions he was jumping up the sides of the cage but i was told is just becouse he is panicking and he wants to escape but he is ok now .	jumping	9	Pres
The events of last week - which originated outside the Conference of Presidents , that Conference being used simply to corroborate and ratify decisions taken elsewhere - present us with a dilemma .	originated	7	Past
I melt brass and cast it http://www.mikegigi.com/castgobl.htm	cast	4	Pres
Microsoft waits for death of Internet Explorer 6	waits	1	Pres
Until Europe wakes up , this unity will not be achieved .	achieved	10	Past
You can see them visiting and talking as they stroll along the streets , sit in the plazas or dine in the many sidewalk restaurants .	stroll	9	Pres
But women remain underutilized , to the detriment of the entire economy .	underutilized	3	Past
The Kerry camp blames Bush for the Swift boat veterans ’ attack , but anyone who has spent much time talking to the Swifties gets the sense that they are doing it entirely for their own reasons .	blames	3	Pres
They should have discussed a bland diet with you , including the frequency of feeding and how much to feed at each sitting .	discussed	3	Past
I had this ridiculous celebrity stylist from LA named Derrick .	named	8	Past
i have a 1 and a half year old male neutered cat and a new 2 month old spayed female kitten .	spayed	18	Past
I 've toured this place and was impressed by how clean the place was , and all the options for the dogs .	toured	2	Past
Adding all the Enron " Specified Entities " would only make a default under a financial transaction with those other Enron entities a default under this agreement .	Specified	5	Past
On the positive side , the FERC commissioners lauded Wolak , his analysis , and his remarks on the panel .	lauded	8	Past
It surrounds you .	surrounds	1	Pres
The subpoenas will force those involved , including Winter , to provide sworn testimony about the events to the committee , and to turn over e-mails , personal calendars and memos .	sworn	12	Past
Greek court has ruled that worshippers of the ancient Greek religion may now formally associate and worship at archeological sites .	worship	16	Pres
Quinn , he muttered to himself .	muttered	3	Past
" Balzac 's use of repeating characters , moving in and out of the Comédie 's books , strengthens the realist representation .	strengthens	18	Pres
The Weasleys roared with laughter and Harry settled back in his seat , grinning from ear to ear .	grinning	13	Pres
Set up last month to centralize merchant asset activities .	Set	0	Past
I brought it back with 9000 miles .	brought	1	Past
Our friend is a world traveler and loves unpretentious dining experiences and inspired food .	loves	7	Pres
Even on a sunny morning the stone buildings of Jerusalem chill your hands and feet .	chill	10	Pres
An enhanced position signoff process will be implemented prior to end Q1 covering gross tonnage , spread positions and summarised analyses for brand and locations .	implemented	7	Past
I have inserted the company details of Uecomm as requested .	inserted	2	Past
As I recall , this bus drops you off near the Opera in Paris .	drops	6	Pres
It 's not an exaggeration to say that what they 're having to do is introduce a so-called democratic social system in place of a paternalist discipline .	so-called	17	Past
Your application is still evaluated on a number of criteria , not all of them as " cast in steel " as the points .	evaluated	4	Past
Cursed – Has Claimed the Lives of Nineteen Muggle Owners to Date .	Claimed	3	Past
It may also be privileged or otherwise protected by work product immunity or other legal rules .	protected	7	Past
Sectarian tensions are at their highest since April , 2004 , with Sunni insurgents now openly attacking Husseiniyas and Shia mosques .	insurgents	13	Pres
" Further , I find it even more disturbing that he made these comments about a nation that just last year tested nuclear weapons -- shortly after voicing his public opposition to the Comprehensive Test Ban Treaty .	tested	21	Past
The problem is that these factors are not amenable to isolated public - health interventions .	isolated	10	Past
This French born , French trained chef and his creative partners offer a taste fresh , locally sourced , fabulously prepared food in the most unlikely of locations .	sourced	17	Past
Some strategies being used by NASA & Company in relation to China and other space planning countries are mentioned here after being gleaned from a news item underneath .	gleaned	22	Past
It was a natural thing , but I never coined myself as ' The Mets Poet . '	coined	9	Past
Here is what they posted there	posted	4	Past
Complexities surrounding the operation of the Off Balance Sheet Facility ( " OBSF " ) which commenced two weeks before the year end .	commenced	16	Past
The amendment to the Directive on today 's agenda does not therefore affect the existing harmonisation of the transport of dangerous goods in the community .	affect	12	Pres
1560 Ruy Lopez visits Rome and defeats all the players .	defeats	6	Pres
We will fight with them about who owes the $ 200 k that James mentions below based on their failure to " assist " us in managing the cost .	owes	7	Pres
Unfortunately , with respect , it shows an enormous ignorance of what actually happens to wine in those countries that it is shipped to .	happens	13	Pres
He is pimply , his neck is thin , his blue eyes goggle , his underlip extrudes .	goggle	12	Pres
I found my initial selection satisfactory but the wine flight we chose to be poorly composed .	chose	11	Past
I was basically hauled in and told that my mum had attacked the church and that I needed to disconnect from her because she was suppressive . Valeska Paris	hauled	3	Past
The commuting crowds can be avoided however by walking from NTU Hospital Station or Shandao Station .	avoided	5	Past
Many Iraqis , including conservative and religious Iraqis , are surprisingly rooting for the Iraqi Communist party , probably in an attempt to counter the influence of Islamists in the forthcoming National Assembly .	rooting	11	Pres
Behind this raw matter one of the reclaimed , the product of the new forces at work , strolled despondently , carrying a rifle by its middle .	strolled	18	Past
Attached for your review is a blacklined version of the : ( a ) Schedule and ( b ) Paragraph 13 to the ISDA Master Agreement .	blacklined	6	Past
The latter , regarding the Jesuit order , illustrated his lifelong admiration for the Catholic Church .	regarding	3	Pres
I ca nt speak for them but any tests or appointments they recommend are probably in the best interests of us ( the patient ) and you have the ability to decline anything that they suggest to you .	suggest	35	Pres
You can not set the SQL query mode new database default to ANSI-92 in 2000 file format because the option is disabled ;	disabled	21	Past
Shakespeare uses it , for example , to convey the turmoil in Hamlet 's mind .	uses	1	Pres
Imagine if the disbursement of all assistance to countries in trouble required Congressional approval , let alone spending from the US budget .	Imagine	0	Pres
He was obeyed , yet he inspired neither love nor fear , nor even respect .	obeyed	2	Past
1 ) It is not normal for dogs to be vomiting , much less to have blood in it .	vomiting	10	Pres
Hope you 've been storing up sleep , cause it looks like you wo n't be getting much for a while .	storing	4	Pres
I posted this in singles and dating too , so I 've just copied and pasted .	pasted	15	Past
Anything you could do to help further my goals would be appreciated .	appreciated	11	Past
Japanese Prime Minister Shinzo Abe , too , has identified increased female labor - force participation as critical to efforts to revive his country 's long - dormant economy .	identified	9	Past
The sitting was suspended at 11.25 a.m. until voting time at 11.30 a.m. .	suspended	3	Past
Today , the dominant method for reducing insect populations – the so-called " sterile insect technique " ( SIT ) – relies on radiation to sterilize males , which are then released into infested areas to mate .	relies	21	Pres
Within the European Union , resale right exists in the legislation of eleven Member States , but it is only really applied in eight .	exists	7	Pres
You r gon na be the first to see the new baby ( woud n't it be wierd if the baby gets botn on Jan 5th ? )	botn	22	Past
Only the gloom to the west , brooding over the upper reaches , became more somber every minute , as if angered by the approach of the sun .	angered	21	Past
* Adopts guidelines to improve reliability and help moderate prices in gas commodity markets , and identifies the capital projects needed to meet these guidelines over the course of the GA II period ( 2003 - 2007 ) . *	identifies	16	Pres
Anyone can become a monkey ; it takes serious study to become a magician .	takes	7	Pres
The ingredients are shaken and/or poured into a cocktail glass .	shaken	3	Past
Bottom line is that when it 's a small privatly owned resturant like this is you can tell that the owners and employees take pride in their product and service .	owned	10	Past
This place is identical to the Youngstown Sports Grille , so I imagine they are owned / operated by the same people .	owned	15	Past
He 's dropping weight , but most of that came from being at the trainer s and being ridden hard for 60 days .	dropping	2	Pres
46 - Percentage of voters who describe themselves as born - again Christians .	describe	6	Pres
No one shall be subjected to arbitrary interference with his privacy , family , home or correspondence , nor to attacks upon his honour and reputation .	subjected	4	Past
i m pretty sure that they do see things on the tv screen because my cat chases things around the tv screen	chases	16	Pres
Incitement by Arab TV , accompanied by horror pictures of mutilated bodies , has become a powerful weapon of those who lie , distort and want to destroy everything .	distort	23	Pres
It must be stamped out .	stamped	3	Past
130 - Approximate Number of countries ( out of a total of 191 recognised by the United Nations ) with a US military presence .	recognised	13	Past
Have you decided who will be assisting tax - wise for these two countries ?	assisting	6	Pres
Per our conversation a few minutes ago , attached please find the revised Stipulation .	attached	8	Past
Recently , Bush addressed the nation .	addressed	3	Past
The only downside is they should be kept in pairs or trios and require a pretty large habitat .	require	13	Pres
Real-time suggested bids for our auction - based system provided guidance that enabled G5 to hone advert effectiveness based on their various targeting filters ( age , college level and location ) .	targeting	22	Pres
Scholars are not certain when each of the 154 sonnets was composed , but evidence suggests that Shakespeare wrote sonnets throughout his career for a private readership .	suggests	15	Pres
The United States understands this now , after September 11 .	understands	3	Pres
" At some point , Patricia tripped or the bear tripped her and was at her back .	tripped	10	Past
Nobody pays someone to keep their horse in shape and rides once a week , then takes all the ribbons at the show because their horse is good .	rides	10	Pres
At the same time that one truly European own resource is waning rapidly in its importance .	waning	11	Pres
In Access 2000 , you can only programmatically change the ANSI SQL query mode and any queries created under ANSI-92 mode were hidden in the Database window .	hidden	22	Past
Re-interviewed and am going on interviews for a new job .	Re-interviewed	0	Past
The current system tends to reinforce gender roles , encouraging children to follow culturally framed paths , instead of nurturing their individual interests and potential .	tends	3	Pres
Every now and then , while dinner was awaited , their conversation was backed by intensely sociable sounds – pitched talk – let in from the kitchen as the servant went in and out , laying the table .	awaited	8	Past
I HAD TO ASK THE GIRL WHO BROUGHT MY FOOD AND SHE NEVER CAME BACK TO LET ME KNOW .	BROUGHT	7	Past
There is an emerging consensus that anthrax was contained in a letter to AMI , the publisher of the National Enquirer -- in a goofy love letter to Jennifer Lopez enclosing a Star of David and proposing marriage .	contained	8	Past
Steal a horse straight out . Very well . He has done it . Perhaps he can ride .	done	11	Past
As one that s battled hard through many a broken dream Let me say , " in order to rise to the occasion you must be willing to go down with the ship " ,	battled	4	Past
I called the store and the clerk giggled , and agreed that it was gross , but said it was not her problem .	giggled	7	Past
Festus could be heard retailing the exchange , confidently in the right , in the kitchen ;	retailing	4	Pres
For the next hour Quinn alternated between dialing and waiting , always with the same result .	dialing	7	Pres
But as I stood on this hillside , I foresaw that in the blinding sunshine of that land I would become acquainted with a flabby , pretending , weak-eyed devil of a rapacious and pitiless folly .	acquainted	21	Past
Look around you and notice all the mind numbing trailor trash cretins out there who should not be procreating , yet they do .	procreating	18	Pres
But realizing this potential requires improving the business climate across the economy as a whole and within individual sectors – particularly by addressing the endemic corruption and weak rule of law that are deterring foreign and domestic investors alike .	requires	4	Pres
I congratulated this establishment for doing the research on making NYC pizza because these Scots fcking nailed it .	congratulated	1	Past
If the US attacks Iran , it is probable that American forces - already taxed by attacks from Sunni factions - will also face reprisal attacks in Iraq from Shi'ite factions loyal to Iran .	taxed	14	Past
It simply refers to the same ICC publication for the transfer process that governs the letter of credit generally .	governs	13	Pres
Should the statue of David be censored ?	censored	6	Past
When he went home on leave he rioted on a large scale – pompously . Jack ashore – with a difference – in externals only .	rioted	7	Past
We hope that in time , we will have millions of articles with many of them having featured status .	featured	17	Past
I could not go to their country and demand they slaughter and sell an animal as meat the way I prefer to eat it .	slaughter	10	Pres
There she studied with Rem Koolhaas , Elia Zenghelis and Bernard Tschumi .	studied	2	Past
Seventeen-year-olds sleep on friends ’ couches , I know .	sleep	1	Pres
Returning to it next day , I found Faulkner guilty of no offense .	Returning	0	Pres
Your mama is so fat : When she hauls ass she has to make two trips .	hauls	8	Pres
Similarly , the dot-com bubble that preceded this period was marked by innovation – Web sites through which one could order dog food and soft drinks online .	preceded	6	Past
Good point , but I 'm comfortable we 're covered because our bidders were all bidding on a chunk of capacity and primary points .	covered	9	Past
You said you liked her and she accepted it as a truth and perhaps as a compliment , but it does not mean she fancies you or wants to pair off with you .	fancies	24	Pres
The Comédie Humaine remained unfinished at the time of his death - Balzac had plans to include numerous other books , most of which he never started .	remained	3	Past
Cures insomnia .	Cures	0	Pres
This meant that he was constantly in danger of quickening his pace and crashing into Stillman from behind .	quickening	9	Pres
Some attributions , such as Titus Andronicus and the early history plays , remain controversial , while The Two Noble Kinsmen and the lost Cardenio have well - attested contemporary documentation .	attested	28	Past
This procedure guarantees that all countries applying for membership are treated equally .	guarantees	2	Pres
* gasps * So I would n't make a good prostitute ?	gasps	1	Pres
He snatched up Hedwig 's cage , dashed to the window and passed it out to Ron .	passed	12	Past
Uncle Vernon sat back down , breathing like a winded rhinoceros and watching Harry closely out of the corners of his small , sharp eyes .	breathing	6	Pres
Localist group Civic Passion 's Wong Yeung-tat was defeated in this district , and resigned his leadership in Civic Passion .	resigned	14	Past
The way China develops is vital for the way our own societies develop .	develop	12	Pres
" native of Crete " EL GRECO dies : April 7 , 1614 Monday	dies	7	Pres
Dudley , who was so large his bottom drooped over either side of the kitchen chair , grinned and turned to Harry .	grinned	17	Past
Security measures are strict on flights to Israel , the bags are searched , the men are frisked , and the women have an electronic hoop passed over them , fore-and-aft .	frisked	17	Past
Both Mr. Parenteau and Ms. Doyon , however , were bleeding badly .	bleeding	10	Pres
The islands lie 860 km east of Christchurch , in the middle of the " Roaring Forties " .	lie	2	Pres
" Large as Balzac is , he is all of one piece and he hangs perfectly together .	hangs	14	Pres
The inner circles are primarily financed by terrorist states like Iran and Syria , until recently also by Iraq and Libya and earlier also by some of the Communist regimes .	financed	5	Past
Your visa should say whether or not you are restricted to work in a specific sector .	restricted	9	Past
" I wonder if he 's praying for you . "	praying	6	Pres
openness of participation , added value , representativeness , quantified and staged objectives , involvement of civil society , monitoring and reporting , cost-effectiveness of administering a self-regulatory initiative , sustainability .	quantified	9	Past
Harry knew he should n't have risen to Dudley 's bait , but Dudley had said the very thing Harry had been thinking himself maybe he did n't have any friends at Hogwarts	thinking	22	Pres
She may be out because in the past she always responds pretty quick .	responds	10	Pres
You will notice that Questar has requested a " Payment Plan " that details when they will pay Transwestern for the interconnect due to the recent Enron events .	requested	6	Past
The long awaited relief you 've needed in your love life is around the corner , and by the end of the year you will feel much clearer about your partnerships in general .	awaited	2	Past
Attached is my draft of a request for rehearing .	Attached	0	Past
If anyone would like to be conferenced in or attend in person , please let me know .	conferenced	6	Past
Since each account belongs to one person , we require everyone to use their real name on their account .	require	9	Pres
Some ants were infected with Beauveria bassiana , a fungus .	infected	3	Past
Use funnels , measuring tubes , and basters to keep everything well-measured and well away from you .	well-measured	11	Past
Creative Commons makes no warranties regarding the information provided , and disclaims liability for damages resulting from its use .	disclaims	11	Pres
When you copy an interior horizontal line , the new line is halfway between the line you copied and the line below the line you copied .	copied	25	Past
Changing security settings by using the GRANT and REVOKE SQL statements	Changing	0	Pres
Such ignorance was refreshing .	refreshing	3	Pres
You either 1 ) sacrifice on breadth and do n't produce the topics that wo n't interest advertisers , or 2 ) you sacrifice on quality and produce content that does n't cost much to write .	sacrifice	23	Pres
Over nine dozen temples that had served the Hindu population have been destroyed , with some used as building material and others used as urinals .	destroyed	12	Past
Came the disintegration of the Beatles ' minds with LSD which has caused , among others , schizophrenic lyrics such as " I am the Walrus " and incoherent schizophrenic musical expositions like " Revolution number 9 " .	Came	0	Past
Therefore , any trade mark registration that incorporates the word ONLINE as a suffix in the way that you use it will not enable its owner to prevent others from using the word ONLINE .	incorporates	7	Pres
On Friday , fishermen rescued over 700 asylum seekers whose boat sank , and the Indonesian Navy reportedly saved 200 more after they were found swimming along the coast of Aceh , Indonesia .	saved	18	Past
They trust you and me to be befuddled by their actions , while they " do as they wilt . "	befuddled	7	Past
The single most costly thing we spend on is rent and advertising , those two together make up the bulk of what we spend .	spend	23	Pres
i.e. Are we covered if we proceed a word with " Enron " ?	covered	3	Past
your male is hurting her to put her in her place - biting her scruff is dominance and biting the belly is a move cats use when hunting - to pull the guts out of their prey .	hurting	3	Pres
The deeper problem lies with the excessive financialization of the global economy that has occurred since the 1990 ' s .	occurred	14	Past
