A bar did not appeal to him tonight – eating in the dark , the press of boozy chatter – although normally he would have welcomed it .	welcomed	25	Past
Israel owes the United States at least this much , in this crisis , to cease militarily unnecessary provocations and establish genuine peace .	owes	1	Pres
This right to fork guarantees that wikiHow , the company , will always serve the goal of the mission and our volunteer community .	guarantees	4	Pres
Quinn pushed the door open , walked through the lobby , and rode the elevator to the eleventh floor .	rode	12	Past
a strong consciousness of his own being flooded him as if a stimulant had been injected into his veins .	injected	15	Past
The main ingredients of the Santorum drink include vodka of an orange citrus variety , Baileys Irish Cream , and Angostura bitters .	include	7	Pres
I am a preferred provider with most insurance companies .	preferred	3	Past
I believe that Doug told me the extra was for the cashout that was not invoiced .	invoiced	15	Past
With these operating standards implemented worldwide , we will know as operations professionals that risk is being mitigated and we will be able to ensure Enron top management that there is consistency in operating standards worldwide .	mitigated	17	Past
Not surprisingly , most of the yearly festivals occur during these times so as to take advantage of the crowds and the more favourable weather .	occur	8	Pres
But I am assuring you that all will be well at the end of the day .	assuring	3	Pres
I will never return there again ( and now have some serious doubts about the quality of work they actually performed on my car ) .	performed	20	Past
I brought my car in on a Sunday to replace a shredded tire .	shredded	11	Past
All were awesome , & I had a Dogwood Grilled Cheese which was enjoyable with the fine beers .	Grilled	9	Past
In addition they will be contacting you to discuss their participation in projects outside their rotation .	contacting	5	Pres
I chalked it up to possible nerve damage , because this is what the vet thought and the other cheek muscle was fine and he had no theeth problems .	chalked	1	Past
I LIVE THERE !	LIVE	1	Pres
As always , the interview was conducted on IRC , with multiple people asking questions .	conducted	6	Past
The first night I dreamed of seeing a stray dog and not stopping to pick it up although it was wandering in an empty parking lot near a busy road .	dreamed	4	Past
I have also looked at the photo galleries for an inside look at the decor of the restaurants and I have narrowed it down to three establishments .	narrowed	21	Past
She is not stringing you along since she is actually discouraging you and is honest enough to tell you to stop asking her out .	stringing	3	Pres
Dr. Fortier travelled another three kilometres by foot to seek help in the nearest settlement .	travelled	2	Past
This tax is not well publicized but it is essential to remember it .	publicized	5	Past
" Empirical research pointed to climate as being a strong driver , " she said .	pointed	3	Past
The commission is definitely more responsive to market participants that are articulating the issue , providing specific examples and proposing the solution .	proposing	19	Pres
i v owned beardies for ovr 3 yrs and i handle mine all the time .. they do nt go hard lik eneedle hard but they ar nt pillow soft .	owned	2	Past
We then housed the ants in nests I made using Y-tong [ aerated concrete ] .	housed	2	Past
We also liked the way that Ray checked on the job every day .	checked	7	Past
He always hugs me when he comes , but he gave me at least 5 tight , long , back rubbing hugs while he was there .	hugs	2	Pres
* Offers end user transportation rates for 2003 lower for most customers than rates in effect today . *	Offers	1	Pres
Bombs are exploding everywhere .	exploding	2	Pres
" Realism is nothing if not urban " , notes critic Peter Brooks ;	notes	9	Pres
I highly recommend Debi , she does an amazing job , I " love " the way she cuts my hair , extremely thorough and cross checks her work to make sure my hair is perfect .	checks	26	Pres
Yeah , Mum 's always wishing we had a house-elf to do the ironing , said George .	ironing	13	Pres
Islamabad accuses New Delhi of using its consulates in Kandahar and Jalalabad to train Balochi insurgents who are active in Pakistani Balochistan .	accuses	1	Pres
She was an anthropologist , and Bray accepted this as an explanation for her passion for arranging excursions , on which she carried her baby tied on her back , African style .	arranging	16	Pres
But it has outlived its usefulness , and Microsoft no longer wants to support it .	outlived	3	Past
We are closely monitoring the matter and should know whether the regime has been modified within the next few weeks .	modified	14	Past
They compensate for this by creating the impression that they have a lot of friends - they have a ' quantity , not quality ' mentality .	compensate	1	Pres
Adorned with contemporary Moriori carvings and traditional taonga ( treasures ) , the marae is a magnificent , tasteful and contemporary testament to the ancestors of Te Imi Moriori .	Adorned	0	Past
It should be assigned to North America ( Glen Walloch and Kevin Walker ) .	assigned	3	Past
I conclude by thanking both rapporteurs ,	conclude	1	Pres
While Dudley lolled around watching and eating ice-creams , Harry cleaned the windows , washed the car , mowed the lawn , trimmed the flowerbeds , pruned and watered the roses and repainted the garden bench .	trimmed	22	Past
As a parent , I can well imagine how painful it must be for those families whose children are succumbing to radiation poisoning .	succumbing	19	Pres
Spreading democracy over the world , the Americans first fought rigged elections in Syria , but the old corruption continued despite all their power and money could do .	Spreading	0	Pres
" They are targetting ambulances " , " American snipers are shooting children and pregnant women " , and " They are using cluster bombs against civilians " is all you get to hear from him .	targetting	3	Pres
Expires : 24 Nov 2004 17:32 PST	Expires	0	Pres
You will notice that Questar has requested a " Payment Plan " that details when they will pay Transwestern for the interconnect due to the recent Enron events .	details	13	Pres
I sat in the shadow in my living room for a while , looking at the amorphous mass of the blanket I had been crocheting .	crocheting	24	Pres
So I checked it out with the U.S. Post Office ( 1-800-238-5355 ) and they confirmed that it is indeed legal !!	confirmed	15	Past
These North African and Oriental immigrants are blamed for bringing a baksheesh mentality to Israel ; the intellectuals are blamed for letting the quality of life ( a deplorable phrase ) deteriorate .	blamed	7	Past
We took our 7 month old and she laughed and giggled when ( very harshly I might add ) grabbing and ' kissed ' the goats and lambs .	kissed	22	Past
a few Arab hens are scratching up dust and pecking .	scratching	5	Pres
Gives control over the limbs .	Gives	0	Pres
I graduate in the spring , and so we 'd like to go between then and winter .	graduate	1	Pres
to distribute copies or phonorecords of , display publicly , perform publicly , and perform publicly by means of a digital audio transmission the Work including as incorporated in Collective Works ;	perform	14	Pres
Ask her about the handsome young man from Texas , and she remembers him 32 years later like it was yesterday .	remembers	12	Pres
Thought I recognized you in Rome .	recognized	2	Past
I leave the evening of the 21st , my flight comes in about 10 pm , and leave the morning of the 27th at 6 am .	leave	17	Pres
They always ask if you have meat in your dish , ( for vegetarians like me ) , they scrub an area of the grill and use separate utensils to cook .	scrub	19	Pres
your lineatus are already spawning .	spawning	4	Pres
Harry looked up , hardly daring to believe it .	daring	5	Pres
* Maintains the core aggregation program with some adjustments .	Maintains	1	Pres
in our case , they are only hedging .	hedging	7	Pres
Chairman Sibley and Chairman Wolens ( of the Texas legislature ) are also engaged in market developments .	engaged	13	Past
He obtains these things , but loses the ability to manage them .	obtains	1	Pres
He gave no service to anyone , risked nothing , and did not even slack off efficiently .	risked	7	Past
Meats are kept VERY cold , seafood smells fresh and the serving bar is VERY clean .	smells	7	Pres
Write down a list of everything you are packing , in particular if it 's valuable .	packing	8	Pres
A community of about twenty thousand people had traffic jams worthy of Rome , cars as a matter of course rushing into the reserved bus lanes , screwing everything up and honking madly .	screwing	27	Pres
Interested parties involved should be consulted and cooperate actively in this analysis .	consulted	5	Past
14 - Number of Immigration and Naturalisation Service ( INS ) agents assigned to track down 1,200 known illegal immigrants in the United States from countries where al - Qa'ida is active .	assigned	12	Past
I posted what the owner as said in paragraph 2 & 3 , that is not me to clarify .	posted	1	Past
Both the Irving Independent School District and the Irving Police Department have asserted that the boy 's religion and name were not a factor in the manner in which they approached the situation .	asserted	12	Past
Over the centuries some readers have posited that Shakespeare 's sonnets are autobiographical , and point to them as evidence of his love for a young man .	posited	6	Past
1533 Atahualpa , inca emperor of peru , imprisoned & learns chess .	learns	10	Pres
This led to further dilapidation of the investment-starved city , and many of its streets and buildings show profound signs of neglect .	investment-starved	7	Past
He faxed it to you and will have the original Fedexed overnight .	Fedexed	10	Past
It often nests in tree stumps or under rocks and foraging workers can sometimes be spotted climbing trees .	nests	2	Pres
Fort Lee can also be accessed by boat or ferry from New York City via Edgewater and Weehawken docks .	accessed	5	Past
When i put him off of my bed , he jumps back on and same thing .	jumps	10	Pres
My myTouch 4G crashes with most custom ROMs I install .	install	9	Pres
To his right , ensconced behind the cash register , was the boss , a small balding man with curly hair and a concentration camp number tattoed on his forearm ,	tattoed	26	Past
I highly recommend Fraiser 's for anyone planning a special event for friends , family or business .	recommend	2	Pres
I am taking my wife out for our first year wedding anniversary and we both agree that we want a good steak .	agree	15	Pres
A page that uses a Microsoft Office PivotTable Component	uses	3	Pres
But the longer it takes us to understand the new landscape of this war , the more costly and painful the victory will be .	takes	4	Pres
For example , I am concerned when I buy the monthly bus passes and I have to fill in my SS number .	buy	8	Pres
It sounds ( according to your own statement ) that they had a roomful of dogs , so they must be doing something right - and are keeping those dogs safe from potential problems .	keeping	27	Pres
When that happens , all the substances create a rave and start partying and electrons fly everywhere and what results ?	happens	2	Pres
She had her cards memorized as well as everyone else s ( when you play you 'll see why you can know everyone else s hands ! ) .	memorized	4	Past
Changing the connection information of a page	Changing	0	Pres
This , as well as the deficiencies in the networks of infrastructures and services and a generally very low level of employment , which furthermore is seasonal and lacks diversity , exacerbates the exodus from rural areas .	exacerbates	31	Pres
US and Afghan intelligence will shortly be presenting the ISI with a list of Taliban extremists and their suspected whereabouts .	presenting	7	Pres
1584 Lopez 's book translated into Italian by Tarsia and published in Venice .	translated	4	Past
Each XML document must have a unique root element ( an element encompassing the entire document ) .	encompassing	12	Pres
* Preserves a rate differential between the Redwood and Baja paths , although somewhat less than the current differential . *	Preserves	1	Pres
ISLAMABAD – Last month , Oxford University 's Green Templeton College held its annual Emerging Markets Symposium at Egrove Park .	Emerging	14	Pres
her first stories were published in a minor newspaper under her pen name , Ichiyo Higuchi .	published	4	Past
MUUUUUUM ! howled Dudley , tripping over his feet as he dashed back towards the house .	tripping	5	Pres
This influence shows in Flaubert 's work L ' education sentimentale , which owes a debt to Balzac 's Illusions Perdues .	owes	13	Pres
Highly recommended .	recommended	1	Past
The doctor swabs her upper arm with antiseptic and says , “ I ’m going to give you something to numb it , okay ? ”	swabs	2	Pres
He is now being outperformed by his successors .	outperformed	4	Past
Hundreds of people are feared dead in Mississippi , and the Louisiana city of New Orleans is badly flooded .	feared	4	Past
It is the hospitality from Tom and staff , that makes it feel like a 5 star hotel in the middle of the beach .	makes	10	Pres
But God knows what we 'll get then .	knows	2	Pres
In fact , he left the house he rented in such disrepair -- with damage to the walls and a chandelier destroyed -- that the Montgomery family who owned it still grumble about the unpaid repair bill .	grumble	31	Pres
She feeds well the baby on her own , the baby is ok but she does not go in the nest to stay with him at night ...	feeds	1	Pres
The US chose to ally itself with such groups as the Supreme Council for the Islamic Revolution in Iraq , whose 15,000 - strong Badr Corps paramilitary was trained by the Iranian Revolutionary Guards .	trained	28	Past
Removes lethargy .	Removes	0	Pres
Once we figured out what it was , we played a lot of manuscript email tag , which can be challenging and time consuming given the differing schedules that folks keep in terms of travel , field work , etc.	consuming	23	Pres
Little children are raised on deep hatred and on admiration of so - called martyrs , and the Western World does not notice it because its own TV sets are mostly tuned to soap operas and game shows .	tuned	31	Past
Her limbs were weathered and ringed , like the branches of trees in the dry country .	ringed	5	Past
And that 's finally all anyone wants out of a book – to be amused .	wants	6	Pres
THE DAILY STAR publishes this commentary in agreement with Agence Global	publishes	3	Pres
Due to its remarkable biodiversity , with over a third of the local plant species found nowhere else , Socotra has been designated a UNESCO World Heritage Site .	designated	22	Past
Fresh basil not only tastes better than dried , it actually tastes different , almost as if it were not the same herb .	tastes	4	Pres
A few days before Christmas 2003 , after a renewed audiotape threat by Zawahiri of attacks , to include in the US homeland , the threat level was raised to orange or " high . "	renewed	9	Past
ANYWAY WE DRIVE AROUND IN MY VAN AND SOLVE MYSTERYS AND SHIT	DRIVE	2	Pres
Juan communicated some numbers to me and when reviewing this request would like to ask you to consider the following :	communicated	1	Past
Mark Anderson says that even though Bondad gas flowed , the price was Non-Bondad .	flowed	8	Past
In general , avoid doing the following to prevent problems caused by mixing queries created under different ANSI SQL query modes :	mixing	12	Pres
But , you could live where ever you fancy takes you .	takes	9	Pres
Sir Francis Walsingham dies : April 6 , 1590 Monday	dies	3	Pres
Like The Two Gentlemen of Verona , in which two friends appear to approve of rape , the Shrew 's story of the taming of a woman 's independent spirit by a man sometimes troubles modern critics and directors .	appear	11	Pres
It resurfaced painfully later when - as a renowned and busy author - he traveled to Sardinia in the hopes of reprocessing the slag from the Roman mines in that country .	traveled	14	Past
Peter Dale Scott includes an account of how Terrell 's whistleblowing was stifled by them in his book Cocaine Politics .	stifled	12	Past
It incorporates Mr. Stojic 's and Mr. Kelly 's initial comments .	incorporates	1	Pres
( For some reason it will not let me rate it one star - it is not rated 5 by me ! )	rated	17	Past
This is whale meat that I photographed in a grocery store in Tokyo - or is it ?	photographed	6	Past
When having your car worked on you have to trust the mechanic & this Midas is truly someone you can trust !	worked	4	Past
What is happening today is analogous to developments a few decades ago , early in the era of personal computers .	happening	2	Pres
Attached are my resume and an addendum covering academic & consulting experience .	Attached	0	Past
The husband and wife who run this spot are lovely people .	run	5	Pres
Turkey and Thailand are mired in political crises that reflect long - simmering domestic conflicts .	simmering	12	Pres
My dad is having surgery in Ft. Worth , so I will be heading that way on Monday .	heading	13	Pres
In theory , market - determined currency values are supposed to isolate the domestic economy from the vagaries of international finance , rising when money floods in and falling when the flows are reversed .	reversed	33	Past
Whereas it is essential , if man is not to be compelled to have recourse , as a last resort , to rebellion against tyranny and oppression , that human rights should be protected by the rule of law ;	compelled	11	Past
Those worthy fellows who 've gone down South to Rhodesia and South Africa where they can feel confident they 'll never have a black man on the Bench to give a verdict as biased as a white man 's .	gone	5	Past
Missile batteries arrayed in those mountains could raise bloody havoc with any fleet deployed below .	arrayed	2	Past
I felt my coat tugged at , and tugged again , and at last I looked around .	tugged	8	Past
The flowers were all that I hoped they would be , I have attended several funerals of late unfortunately and the flowers I recieved from Ana outshone them all .	recieved	23	Past
if you do n't mind being robbed , cheated or lied to then this is the company for you .	cheated	8	Past
The Fed 's huge monthly purchases of long-term assets – so-called quantitative easing – have benefited the world as a whole by propping up demand and economic activity in the US .	benefited	15	Past
Some recent research conducted by Oregon State University has given considerable credence to this idea .	conducted	3	Past
A lack of organisation , coupled with the distain for its customers , makes this the worst rental agency I have used .	makes	13	Pres
Tindi Kente is a wonderful dancer , wonderful , is n't she ... just like a snake brought out by music , and sometimes he 'll try with her .	brought	17	Past
“ I had it done when I was little and see , you ca n’t even tell . ”	done	4	Past
I understand that we are still reviewing the attachment that lists the open transactions .	lists	10	Pres
Davis was the settler M.P. who had been responsible , at one stage , for getting Mweta banished to the far Western Province .	banished	17	Past
Under the accord , a new northeastern provincial council was formed and the Indian army was deployed as peacekeepers in the north and east .	deployed	16	Past
They may look young but do n't let that fool you , as their knowledge of music far surpassed what we expected .	surpassed	18	Past
As the American public gradually wearies of the Iraq crisis , some have begun worrying that the war could blow back on the US by creating the conditions for anti-American terrorism .	wearies	5	Pres
She is not stringing you along since she is actually discouraging you and is honest enough to tell you to stop asking her out .	discouraging	10	Pres
Happiness and enjoyment lie ahead .	lie	3	Pres
The pictures are broadcast at a rate of about 60 Hz , which is how fast they need to move for us to see them as a moving , flawless picture .	broadcast	3	Past
The rescued members included Bangladeshis and Rohingya , a stateless minority of Muslims from Myanmar .	rescued	1	Past
Because she was suddenly realizing that it had been so for her .	realizing	4	Pres
Panting , Ron hoisted them up into the car .	hoisted	3	Past
Saving an object as a data access page enables you to quickly convert an object into a page , and allows users of your application to review , enter , and analyze data over the Internet or an intranet .	enables	8	Pres
European-American settlement of the area commenced in the 1860s , and in 1911 the completion of the first of several large reservoirs in the mountains north and east of Phoenix insured its success as a center for irrigation-based agriculture .	insured	30	Past
They said he had caused the fire in some way ; be that as it may , he was screeching most horribly .	screeching	19	Pres
Images of the boy wearing a NASA T-shirt and handcuffed by the police were quickly posted and reposted online .	handcuffed	9	Past
Since 2007 the Andy Warhol Photographic Legacy Program has seeded university art galleries throughout the United States with over 28,000 Andy Warhol photographs and other artifacts .	seeded	9	Past
The view uses a Microsoft Office PivotTable Component , so you can do all the things that you can do on a PivotTable list .	uses	2	Pres
Huskers drool over Sooners .	drool	1	Pres
The relevant standards which have been laid down in another Directive , 95 / 35 / EC , seem sufficiently adequate to advise people in a responsible manner on the organisation of the transport of dangerous goods .	laid	6	Past
I generally like the BK over the other fast serving restaurants ; however , I regreted to visit this restaurant at my town .	regreted	15	Past
I SAY LISTEN : I 'm at 17th and LOCUST , do you deliver there ?	SAY	1	Pres
Quinn was used to wandering .	wandering	4	Pres
The only way for visitors to travel to the Chathams is via scheduled or chartered air service .	scheduled	12	Past
Seince he recieved the fluids last night he said not to worry about drinking water for at least a couple of days .	recieved	2	Past
Over nine dozen temples that had served the Hindu population have been destroyed , with some used as building material and others used as urinals .	destroyed	12	Past
Hands - down the best pasta and gnocchi I 've ever eaten ( and I 've eaten a lot ) .	eaten	11	Past
What 's your greatest non-fixed cost ?	non-fixed	4	Past
Dudley hitched up his trousers , which were slipping down his fat bottom .	slipping	8	Pres
You have heard , of course , that the Ministry is conducting more raids , said Mr Malfoy , taking a roll of parchment from his inside pocket and unravelling it for Mr Borgin to read .	unravelling	29	Pres
Females after their first calf is already weaned :	weaned	7	Past
Peggy is finding out where WD # 143 pumps to onshore .	pumps	8	Pres
I interrupted him by saying I had heard of Mr. Kurtz on the coast .	interrupted	1	Past
* Provides a high degree of rate stability , with a 3.5 % escalator to capture both inflation and the cost of needed capital projects .	Provides	1	Pres
It is the best university in Virginia and continuously receives rave reviews every year .	receives	9	Pres
As a very satisfied new customer , I wholeheartedly recommend United Air Duct Cleaning .	recommend	9	Pres
" It marks the first time in recent years that China has promised to wield its veto power in the UN Security Council against a petition initiated by the United States and backed by France and Great Britain . "	initiated	26	Past
Other pan-democrats elected were Leung Yiu-chung of NWSC and James To of the Democratic Party .	elected	2	Past
Such a formal orientation that typifies this type of structural equivalence is called a " gloss translation " in which the translator aims at reproducing as literally and meaningfully as possible the form and content of the original .	typifies	5	Pres
Before he had a chance to absorb the woman 's presence , to describe her to himself and form his impressions , she was talking to him , forcing him to respond .	forcing	28	Pres
Removes wrinkles .	Removes	0	Pres
A jetty projected into the river .	projected	2	Past
Other than picking up objects from the street , Stillman seemed to do nothing .	picking	2	Pres
Bending to the right indicates : " I know the right way to request You . "	indicates	4	Pres
Are the adherent of ' Crowleyan Thelema ' and others of similar ilk appropriating or appropriating from the appropriators to redirect ' energy ? '	appropriating	13	Pres
Soon afterwards , around the time of his father 's death , Balzac wrote El Verdugo - about a 30 - year - old man who kills his father ( Balzac was 30 years old at the time ) .	kills	26	Pres
The countries which are giving to America to aid are a great example of the seed that America has sown through the years with other nations .	sown	19	Past
I am Lady Kingel and I hail from the United Legit Gaming Guilds of Guild Wars .	hail	6	Pres
He complained about the " visible lack of progress " and reaching an impasse in talks with both sides .	complained	1	Past
Reach your target customers .	Reach	0	Pres
We are receiving invoices from Ace Federal Reporters for transcripts of the recent FERC settlement conferences .	receiving	2	Pres
Petunia ! roared Uncle Vernon .	roared	2	Past
and Julius Caesar — based on Sir Thomas North 's 1579 translation of Plutarch 's Parallel Lives — which introduced a new kind of drama .	introduced	19	Past
Percy muttered vaguely about needing a new quill .	needing	4	Pres
It made Quinn think of an archeologist inspecting a shard at some prehistoric ruin .	inspecting	7	Pres
Attached are the gas settlement and support for May .	Attached	0	Past
Yes , it gives him the " sun rays " necessary , that 's what UVA is .	gives	3	Pres
