It depends on if you ever registered the birth .	registered	6	Past
Martin 's box is working wonderfully - I 'll have everything transferred to it and give him the keys by Friday .	transferred	11	Past
We aim to investigate the contributions of the use of a system that integrates cognitive digital games to a database , of the Escola do Cérebro , for monitoring and improvement of cognitive skills , highlighting the attention .	aim	1	Pres
With the development of artificial twines the sisal boom ended , and Mérida slowed to a more sleepy provincial capital until development picked back up in the late 20th century .	slowed	13	Past
If they 're going kinda slow and like fake biting ( not biting as hard as they can ) , and fake scratching ( not hitting as hard as they can with their paws ) then they 're playing .	biting	9	Pres
And his apartment is so run down down I 'm afraid roaches might be crawling over the baby .	crawling	14	Pres
Now truck fenders are rusting there , the twentieth century adding its crumbling metal to the great Jerusalem dust mixture .	rusting	4	Pres
The moving company is actualy based in Brooklyn , but advertised all over NY / NJ , including Fort Lee .	advertised	10	Past
that OBSF values within the extended trial balance may be misstated due to data issues ( above and beyond existing conversations with AA on model simplifications )	misstated	10	Past
$ 401.3 b - Proposed military budget for 2004 .	Proposed	4	Past
Do you raid terrorist headquarters , hidden in a mental hospital ?	hidden	6	Past
Numbered streets run East / West with Main Street and the Arkansas River as the dividing line .	run	2	Pres
Just recently discovered them last time I was down there , they 're very nice ) www.kaffeeeis.co.nz	discovered	2	Past
The Wolfson Foundation of London has paid for the planting of gardens , and Arab kids are kicking a soccer ball in the green bottom of the valley .	planting	9	Pres
" Across the United States , the northern edge of species ' range is expanding , " she said .	expanding	14	Pres
ESAI contributes oil and gas input price forecasts , capacity judgments , and " herding " ideas to develop power price forecasts for same time periods .	contributes	1	Pres
Every time the elevator reaches a new floor , say “ ding ! ” very loudly .	reaches	4	Pres
There are a number of key points that I would like to address before concluding .	concluding	14	Pres
You either 1 ) sacrifice on breadth and do n't produce the topics that wo n't interest advertisers , or 2 ) you sacrifice on quality and produce content that does n't cost much to write .	sacrifice	4	Pres
The doctor bares my mother ’s arm , where the crepey flesh hangs loosely on the bones .	bares	2	Pres
They have been accumulating for years , and basically give the president to sieze the government whenever he feels like it .	accumulating	3	Pres
Just as he opened his mouth to speak , he was interrupted by a clattering of keys at the front door , the sound of the door opening and then slamming shut , and a burst of voices .	clattering	14	Pres
The reality is that it stands for and operationalizes US power , in cooperation with America 's closest allies .	operationalizes	8	Pres
Huge amounts of money , which could have solved many social problems in this dysfunctional part of the world , are channeled into three concentric spheres supporting death and murder .	solved	8	Past
Why , how can i build up realtion ship with him he is also not useing the thing that he runs on and he wakes up walks around and goes to sleep again ???	wakes	24	Pres
However , if they have been vomiting numerous times , then the blood could be due to irritation of the stomach and intestines .	vomiting	6	Pres
A page created using Microsoft Access 2000 must be converted before it can be used with Access 2002 .	converted	9	Past
in the end , however , it pays to differentiate .	pays	7	Pres
Worse for Israel , the assassination drew a denunciation even from the moderate and cautious Grand Ayatollah Ali Sistani , who wields enormous moral authority over Iraqi Shiites .	wields	21	Pres
A small number of actions geared on the protection against currency counterfeiting are carried out under other Community programmes , such as TAIEX and Twinning .	geared	5	Past
But in the meantime , highly recommend jeans and long sleeves anytime you 'll be interacting with the kittens .	interacting	15	Pres
We took it back in to have it repaired again , and less than a week later the second compressor went out .	repaired	8	Past
Like the previous poster said , the com lines are split between the entire building .	split	10	Past
They showed some kids on TV , and they were quite taken with it .	showed	1	Past
Give me a call Tuesday afternoon to discuss ( gone to Kelowna golfing for the weekend ) .	gone	9	Past
But there was one yet – the biggest , the most blank , so to speak – that I had a hankering after .	hankering	21	Pres
We look to the Commission also to ensure that there is matched funding for projects .	matched	11	Past
" They ( electricity generators ) grinned and beared the $ 750 price cap , but this new plan by ISO was too much , " said Dunn , whose committee has been investigating since March .	investigating	33	Pres
His initiation took place on April 17 , 1789 , at Holland Lodge No. 8 , F&AM , which the Grand Lodge of New York F&AM had chartered in 1787 .	chartered	27	Past
The numbers indicate that in his first four years , Bush not only showed up , he showed up a lot .	showed	17	Past
It is also encouraging citizens to ask for application of the law in their local municipalities .	encouraging	3	Pres
Once two sets of leaves have formed , basil can be planted into the garden or permanent containers .	planted	11	Past
Directive 78 / 170 / EEC should therefore be repealed .	repealed	9	Past
Mr Martin , please reply without engaging in a dialogue , as the Rules do not provide for one .	engaging	6	Pres
There was an air of plotting about that station , but nothing came of it , of course .	plotting	5	Pres
The South retaliated by firing dozens of rounds of artillery into the north .	retaliated	2	Past
The last three years of the Iraq occupation , however , have sapped this confidence .	sapped	12	Past
The classes cover all age and skill ranges , with BALLROOM , LATIN , SEQUENCE , STREET , DISCO , LINE DANCING , BALLET , TAP & JAZZ .	cover	2	Pres
I think she likes her special room in your house .	likes	3	Pres
When she was spayed the vet had a hard time because she only has one uterine horn and he said this could mean she only has on kidney .	spayed	3	Past
The above applies to the Work as incorporated in a Collective Work , but this does not require the Collective Work apart from the Work itself to be made subject to the terms of this License .	applies	2	Pres
Even civil servants at national and local government level in Britain are not allowed to get involved in electioneering as the Commissioners are doing .	electioneering	18	Pres
A third narrative poem , A Lover 's Complaint , in which a young woman laments her seduction by a persuasive suitor , was printed in the first edition of the Sonnets in 1609 .	laments	15	Pres
The rapporteur has also quite rightly stated that Parliament was not heard in time regarding the guidelines .	stated	6	Past
the group to which Edwardsiella andrillae belongs includes many species that reproduce asexually , and it 's possible that the fields are " clones " produced asexually rather than the result of sexual reproduction .	reproduce	11	Pres
The President is very eager to go ahead quickly and get this vote , because he very much wants to have Samuel Alito on the Supreme Court , to be judging the cases Bush is interested in .	judging	30	Pres
ANA took this approach by creating a Facebook page to acquire interested users for ongoing messaging opportunities and developing a compelling advertising campaign .	compelling	20	Pres
Japan protested , to no avail , that the project should be a joint one .	protested	1	Past
I wish all happy holidays , and moreso , wish peace on earth .	wish	1	Pres
When regarding an artwork , a viewer gathers information through a series fixations , interspersed by rapid movements of the eye called saccades .	gathers	7	Pres
Also , Beardies often do not eat food that is not moving , so it s anyone 's guess whether or not he 'll touch the freeze - dried crickets or the processed food .	moving	11	Pres
Mrs Weasley was marching across the yard , scattering chickens , and for a short , plump , kind-faced woman , it was remarkable how much she looked like a saber-toothed tiger .	scattering	8	Pres
I 've had a lot of cats who refused to eat the canned food .	canned	12	Past
President Bush has always said that working for Blount was the reason he transferred to the Alabama Air National Guard .	transferred	13	Past
' Ah ! So they talk of him down there , he murmured to himself .	murmured	12	Past
I pray that you understand our plight .	pray	1	Pres
GOODWYN : The candidate Mr. Bush was working for , Red Blount , had gotten rich in Alabama in the construction business .	gotten	14	Past
" But he likes everyone .	likes	3	Pres
Helps in self - expression and develops one 's potentiality .	Helps	0	Pres
Some of the major differences I see is the HD video , longer battery life , and faster processor that the NOOK Tablet boasts .	boasts	23	Pres
He felt as though Auster were taunting him with the things he had lost , and he responded with envy and rage , a lacerating self-pity .	taunting	6	Pres
Following the American Revolutionary War , L'Enfant established a successful and highly profitable civil engineering firm in New York City .	established	7	Past
If democracy is just free elections , it is likely that the most fanatic regime will be elected , the one whose incitement and fabrications are the most inflammatory .	elected	17	Past
We are run as a Hybrid Organization - a for-profit company focused on achieving a social good .	run	2	Past
Fill in the subject , this will be the header that everyone sees as they scroll through the list of postings in a particular group , click the post message button .	scroll	15	Pres
Although it is highly built up , Fort Lee also houses many playing fields and recreational parks as well as bike and running trails .	houses	10	Pres
Two vaunted economists - one a Nobel Prize winner and the other a nationally renowned budget expert - have analyzed the data at hand and put a price tag on the Iraq occupation .	analyzed	19	Past
That pollution was money to that community , and those people dealt with the pollution and absorbed it into their skin and into their bodies because they needed the money .	absorbed	16	Past
I 'm unsure of this , because once I watched a commercial of cat food with my cat and she did n't react to seeing another cat on TV .	watched	9	Past
I dislike this urban society and want to leave this whole enviroment .	dislike	1	Pres
Before coming to Acupuncture DOCTOR I was a big baby about needles and only came because my boyfriend 's aunt recommended it .	recommended	20	Past
I KNOW YOU HAVE A LOT GOING ON WITH YOU AND THE LITTLE WOMAN .	KNOW	1	Pres
Her eyes were veined with red .	veined	3	Past
I 'm assuming it 's to scare off predators / like how they will puff up their neck spikes to make them look bigger to predators or enemies .	assuming	2	Pres
Just yesterday we switched over to a new site which has a demo of the VM ( virtual microscope ) I invite you to check it out .	invite	21	Pres
Prices listed , however , are usually based on two people in a cabin , and you will likely face some high " single supplement " costs in addition .	listed	1	Past
However , in April 2001 , the IAEA published Fifteen Years after the Chernobyl Accident - Lessons learned . which contradict the earlier reports .	contradict	20	Pres
Perhaps Jim Armogida can assist in revising them as I am sure he is more familiar with the way Enron Corp. likes their resolutions drafted than we are .	likes	21	Pres
Tree swallows are nesting nine days earlier .	nesting	3	Pres
$ 1 m - Estimated value of a painting the Bush Presidential Library in College Station , Texas , received from Prince Bandar , Saudi Arabia 's ambassador to the United States and Bush family friend .	Estimated	4	Past
However , when you get off that aeroplane , if you have n't pre-organised transport , you will have to walk , and it is a long way into town .	pre-organised	13	Past
L'Enfant was recruited by Pierre Augustin Caron de Beaumarchais to serve in the American Revolutionary War in the United States .	recruited	2	Past
He and his master dragged me to my room and held judgment upon me as a convicted traitress .	dragged	4	Past
She pointed to the refreshment table with Campbell 's Soup served with " electric " Kool Aid and tables adorned with colorful gumball " pills " .	pointed	1	Past
She gave a small , self-questioning shrug , admitting the glibness of another kind of daily talk in another time .	admitting	8	Pres
This I would have read without flinching in Chicago but in Jerusalem I flinched and put the book down .	flinching	6	Pres
Test simple image and text - based adverts and use what works .	Test	0	Pres
Spreading democracy over the world , the Americans first fought rigged elections in Syria , but the old corruption continued despite all their power and money could do .	fought	9	Past
Filtering by selection is particularly useful for fields in the detail area , when you want to view all of the rows that contain a particular value .	Filtering	0	Pres
I also have a profile they fill out for me , a mini-MMPI that I developed , so that I have an idea -- Rebecca and I put it together	fill	6	Pres
* Offers a 7.5 cent / dth rate to large customers while minimizing rate changes to other customers , minimizing the incentive for these customers to seek to bypass local transmission charges and other CPUC - approved charges . *	Offers	1	Pres
The major exception is downtown , which is slanted at almost a 45 degree angle to the rest of the grid .	slanted	8	Past
What greatness had not floated on the ebb of that river into the mystery of an unknown earth ! ...	floated	4	Past
He closed his eyes again wishing it would stop , and then – he fell , face forward , onto cold stone and felt his glasses shatter .	wishing	5	Pres
Dudley , who was so large his bottom drooped over either side of the kitchen chair , grinned and turned to Harry .	drooped	8	Past
This draft reflects the changes we discussed during our call the other day .	discussed	6	Past
Other methods , such as the method adopted in 2005 , makes the snitch a tennis ball in a sock , hanging out of the running shorts of the snitch runner .	makes	11	Pres
" Marcel Proust similarly learned from the Realist example ;	learned	4	Past
" They ( electricity generators ) grinned and beared the $ 750 price cap , but this new plan by ISO was too much , " said Dunn , whose committee has been investigating since March .	grinned	6	Past
Limerick 's a great student city , there 's loads on , you 'll be spoilt for choice .	spoilt	15	Past
But succintly making point after succint point , the text of the letter stands on its own merit , regardless .	stands	13	Pres
He took a deep breath , scattered the powder into the flames and stepped forward ; the fire felt like a warm breeze ; he opened his mouth and immediately swallowed a lot of hot ash .	swallowed	30	Past
Hundreds of people are feared dead in Mississippi , and the Louisiana city of New Orleans is badly flooded .	flooded	18	Past
Some localized extinctions already have occurred across some of its habitat .	occurred	5	Past
The recall of all OBSF stock in early April and retention on balance sheet ( reduced where economically viable ) until positions are fully reconciled and repeatable daily signoff process can be instigated .	instigated	32	Past
We also know how Dan Rather libeled George Bush and impugned his service in the Texas Air National Guard on a " 60 Minutes II " report based largely on forged documents .	forged	30	Past
Until Europe wakes up , this unity will not be achieved .	wakes	2	Pres
Wikinews observed the USI exhibit identifies and features Polaroids of fashion designer Halston , a former resident of Evansville .	identifies	5	Pres
Then 1 lap at a walk around the arena with both my legs pulled out as far as I can , so they are not touching the saddle .	touching	25	Pres
He lathered his face , took out a clean blade , and started scraping off his beard .	lathered	1	Past
According to the Arts and Humanities Citation Index Professor Chomsky is the eighth most cited scholar of all time .	cited	14	Past
When you distribute a Web page that uses components , users who do not have the components installed will be prompted to install the components , provided the Web page designer configures the components to do so .	uses	7	Pres
Think internally , intuitively , not by words , of the meaning , as you 're repeating it .	repeating	16	Pres
EVERYTHING IN HERE SEEMS TO AMAZE ME !!!	SEEMS	3	Pres
In which case , the only cost to Enron is the internal cost incurred to understand better the risks of getting fingered .	incurred	13	Past
It is a bustling place where separate parties are seated at the same table ( as in many European cafes ) , but if you are OK with that , the food is very good .	seated	9	Past
We know that there are boats plying between Morocco and Spain and Gibraltar , and that the different authorities concerned are cooperating fully .	cooperating	21	Pres
The European Commission maintains that everything depends on supply .	depends	6	Pres
Once , Quinn observed , he even stooped down for a dried dog turd , sniffed it carefully , and kept it .	stooped	7	Past
In the New Territories West geographical constituency , nonpartisan pan-democrat Eddie Chu was elected with 84,121 votes , the most given to any list in the geographical constituencies .	elected	13	Past
Kori told me she saw you last night at Steak Night and introduced herself since I failed to do so the last time we went .	introduced	12	Past
India keeps what it has while Pakistan and China ( which was gifted a slice of the territory three decades ago ) do likewise .	gifted	12	Past
I am referring to the Rio Coco project .	referring	2	Pres
When s/he responds , add your own comments or ask follow-up questions and proceed from there !	responds	2	Pres
wikiHow achieved this popularity for a few reasons .	achieved	1	Past
Just as he opened his mouth to speak , he was interrupted by a clattering of keys at the front door , the sound of the door opening and then slamming shut , and a burst of voices .	interrupted	11	Past
Balzac had better luck publishing the memoirs of Laure Junot , Duchess of Abrantès - with whom he also had an affair .	publishing	4	Pres
His press release following the hearing renewed the call for " refunds . "	renewed	6	Past
the food was horrible not cooked like it should be , they got the order wrong on a number of occasions , and once forgot about my order .	cooked	5	Past
More than anything else at Hogwarts , more even than playing Quidditch , Harry missed his best friends , Ron Weasley and Hermione Granger .	playing	10	Pres
No term or provision of this License shall be deemed waived and no breach consented to unless such waiver or consent shall be in writing and signed by the party to be charged with such waiver or consent .	deemed	9	Past
“ There have no business being there unless they are undermining Pakistan , ’’ says a Pakistani official .	undermining	10	Pres
I flung out of his hut ( he lived all alone in a clay hut with a sort of veranda ) muttering to myself my opinion of him .	flung	1	Past
I expect to send them out to you sometime tomorrow .	expect	1	Pres
Clutching his broken glasses to his face he stared around .	Clutching	0	Pres
sort a wonder what it would have been like ?	wonder	2	Pres
Please approve Susan 's attached expense report and forward to accounting with a cc : to me .	attached	4	Past
The apartment loomed up around him as a kind of blur .	loomed	2	Past
THE MANAGER CAME OVER AND SAID HE WAS SORRY AND GAVE A NEW BATCH OF WINGS , HE SAID WE CA NT REALLY DO ANYTHING BECAUSE THE DOORS ARE ALWAYS OPENING AND CLOSING .	OPENING	30	Pres
But he just melded with everybody .	melded	3	Past
This visa , which is really little more than a piece of paper on which you list your vital statistics , costs between 15 - 25 CUC ( or € 15 - 25 ) , depending on where purchased .	list	16	Pres
This frightened me so that I did n’t dare turn .	frightened	1	Past
At age ten Balzac was sent to the Oratorian grammar school in Vendôme , where he studied for seven years .	studied	16	Past
My hope is that over time , internet users will demand this of any site where they invest their time in a way that creates value for others .	creates	24	Pres
A large group of my friends and I rent almost the whole motel every year for a weekend , and the experience and stay have always been five - star .	rent	8	Pres
Uncle Vernon , Aunt Petunia , and Dudley were all hanging , dumbstruck , out of Harry 's window .	hanging	10	Pres
So-o-o ! he exclaimed .	exclaimed	3	Past
Is the old Devil attempting to disguise as good in front of people .	attempting	4	Pres
Once they fixed it they answetred all of my questions with no hesitations and then gave me the best quote ever .	answetred	5	Past
Yes , GCP provides the links to establish the correlation between the parent and child for our downstream systems .	provides	3	Pres
Secondly , we should not allow this to be postponed indefinitely , and we should not introduce provisions restricted to physical persons .	restricted	18	Past
67 - Percentage of Americans who approved of the way Bush was handling his job as president on 26 September 2002 .	handling	12	Pres
We have already recommended you to some of our friends !	recommended	3	Past
Do n't buy shoes to grow into , because your feet will seem flexed when you pointe and will look flat .	pointe	16	Pres
This overall favourable situation is the result of a long preparation at both legislative and institutional level and demonstrates the high level of cooperation achieved in EU and at international level .	achieved	24	Past
She is also peeing around the box and somehow it gets underneath .	peeing	3	Pres
" That is certainly the assumption on which the London market has been built and the line that successive governments have peddled .	peddled	21	Past
As recently as last week the official line stated they had no knowledge he had entered the country .	stated	8	Past
Some parts of this same outer circle actually operate as a result of fear from , or blackmail by , the inner circles .	operate	8	Pres
I 'm forwarding a revised development agreement term sheet , showing revisions from your original version .	forwarding	2	Pres
The Pakistan ISI and CIA rarely grant press interviews in connection with an ongoing manhunt .	grant	6	Pres
I can not tell you how often I am complimented on my hair ( style AND color ) !	complimented	9	Past
RAPHAEL dies : April 6 , 1520 Good Friday	dies	1	Pres
is the root element which encompasses the entire document .	encompasses	5	Pres
The precise reasons vary from country to country – but many of them stem from entrenched cultural norms that prevent women from reaching their full potential .	stem	13	Pres
The range of activities can be illustrated by describing the water activities .	illustrated	6	Past
Dizzy and bruised , covered in soot , he got gingerly to his feet , holding his broken glasses up to his eyes .	bruised	2	Past
Remember : throughout the book Don Quixote is preoccupied by the question of posterity .	preoccupied	8	Past
In Brazil , a television program on the role that folic - acid supplementation could play in the prevention of spina bifida ( a congenital neural tube defect ) immediately grabbed politicians ' attention .	grabbed	30	Past
i have a 1 and a half year old male neutered cat and a new 2 month old spayed female kitten .	neutered	10	Past
Prices for electricity jumped from an average of $ 249 a megawatt to $ 700 a megawatt within three days , ISO records show .	jumped	3	Past
Saudi officials had already provided safeguards by installing an oval wall with padded edges to protect pilgrams from a crush , installed security cameras and placed over 60,000 security personnel in the area .	padded	12	Past
While L'Enfant was in New York City , he was initiated into Freemasonry .	initiated	10	Past
The current system tends to reinforce gender roles , encouraging children to follow culturally framed paths , instead of nurturing their individual interests and potential .	framed	14	Past
As of 15:11 GMT the site was accessible again , but only loads at relatively slow speeds , and by the end of the day Saturday the site was not loading at all .	loading	30	Pres
The blog aims to help address " a gap between scientists and ' the general public ' . "	aims	2	Pres
USI 's art gallery , like 189 other educational galleries and museums around the country , is a recipient of a major Warhol donor program , and this program is cultivating new interest in Warhol 's photographic legacy .	cultivating	30	Pres
However , we waited and waited and in the mean time , saw 4 groups of people simply just paraded in without signing there names .	waited	3	Past
This procedure guarantees that all countries applying for membership are treated equally .	applying	6	Pres
Balzac spoke often of a " nervous and fluid force " between individuals , and Raphaël Valentin 's decline in La Peau De Chagrin exemplifies the danger of withdrawing from the company of other people .	exemplifies	24	Pres
Amused , my wife asks why I ordered the kosher lunch .	Amused	0	Past
Meanwhile , every pocket that can be lined is golden and the poor are shunted off radar yet again .	shunted	14	Past
EPM , Anyone Dealt with it ?	Dealt	3	Past
Wherever he is , authorities need to focus on the traceable connection between him and those he or Atef recruited .	recruited	19	Past
It is the officer 's meeting for Enterprise , and spouses are invited .	invited	12	Past
