The Herodian relics are all that relics should be columns distorted , well worked over by time , Absalom 's tomb with its bulbous roof and odd funnel tapering out of it .	tapering	28	Pres
About saving an object as a data access page	saving	1	Pres
And when I move it I guess he figures I 'm playing . x.x	figures	8	Pres
What I saw was dozens of school buses submerged that could have been used to evacuate people who had no transportation .	submerged	8	Past
Got some nice " freshly baked " fruit squares , a personal favorite of mine .	baked	5	Past
The forest phlox is blooming in late April instead of mid-May .	blooming	4	Pres
Inequality can corrupt and paralyze a country 's political system – and economic growth along with it .	paralyze	4	Pres
they need to be planted 6 inches apart , since they grow quite large .	planted	4	Past
It resurfaced painfully later when - as a renowned and busy author - he traveled to Sardinia in the hopes of reprocessing the slag from the Roman mines in that country .	resurfaced	1	Past
Harry watched nervously as Draco drew nearer and nearer to his hiding place , examining the objects for sale .	examining	14	Pres
British women too are entitled to the same treatment as all the other citizens of Europe .	entitled	4	Past
They are invoicing for this and I do n't have an invoice for it .	invoicing	2	Pres
A full internal balance sheet review will be completed within the Q1 audit timetable which incorporates	incorporates	15	Pres
China 's economy is exploding , hampered only by their great thirst for petroleum and natural gas to fuel their industry .	exploding	4	Pres
Asked for bar - b - que sauce never got it .	Asked	0	Past
They perpetrated such reckless action as firing 36 shells at KPA civil police posts under the absurd pretext that the KPA fired one shell at the south side .	perpetrated	1	Past
I assume from your message you are OK with this and they can get it nailed down ?	nailed	15	Past
Auster 's face perked up at the sound .	perked	3	Past
Shrugging , he gives up and I turn to the twice disagreeable chicken and eat guiltily , my appetite spoiled .	Shrugging	0	Pres
It boggles the mind that ANYONE can take at face value Bush 's claims to be a christian , yet many seem to do just that .	boggles	1	Pres
I was thinking of very old times , when the Romans first came here , nineteen hundred years ago – the other day ... .	thinking	2	Pres
Shakespeare 's standard poetic form was blank verse , composed in iambic pentameter .	composed	9	Past
He brought fabric books , and pictures of furniture only , which all came way over budget .	brought	1	Past
I MAKE MONEY NOT DEAL WITH BROKERS " Wow , can you believe in today s tough times this dealership would be looking for any way to move vehicles .	MAKE	1	Pres
Japan favoured a route to the sea , enabling oil to be shipped to both Japan and China .	favoured	1	Past
if they bite , and one cries , you must separate them , and you must keep an eye on them .	cries	6	Pres
In a Hadith the Messenger of Allah explains that the souls of the martyrs are in the hearts of green birds that fly wherever they please in the Paradise .	explains	7	Pres
He could n't tell when things were becoming more unstable as opposed to less .	becoming	7	Pres
0 - Number of coffins of dead soldiers returning home that the Bush administration has permitted to be photographed .	photographed	18	Past
The second-class trading area had been laid out long ago and haphazardly ; shops cropped up suddenly , streets met , the car plunged and rolled .	cropped	14	Past
Either these people do n't know anything about what they are renting , or worse - they are bait and switching .	renting	11	Pres
Entering the 747 , my wife , Alexandra , and I are enfiladed by eyes that lie dark in hairy ambush .	enfiladed	12	Past
I just hope that I will be invited to the opening ceremony because we worked damned hard to get it .	invited	7	Past
It has also become an arms depot of the Liberation Tigers of Tamil Eelam ( LTTE ) , who operate almost freely in the Andaman Sea .	operate	19	Pres
CLEMENT 's St. Methodius dies : April 6 , 884 Monday	dies	4	Pres
The necessary report functionality should be available within the AS400 , however contingencies have been initiated to build tactical VBA / excel reports outside of the AS400 but using AS400 data downloads .	initiated	15	Past
Microbiologist Abdul Qadoos Khan was charged along with his son , Ahmed , for harboring the fugitives .	charged	5	Past
Went to the school here OVER PRICED !!!!!!	Went	0	Past
They estimated by 2050 , increasing population and changing diet would increase world food needs by 50 percent .	estimated	1	Past
But if you have to do it by keeping that forty years or whatever sitting at the table with you and your children ... ach , it 's not healthy , it makes me sick .	keeping	8	Pres
That tactic never failed me .	failed	3	Past
The one country that has shown that it understands the realities in South Asia is China .	understands	8	Pres
I tamed them in 4 days .	tamed	1	Past
Secondly , we should not allow this to be postponed indefinitely , and we should not introduce provisions restricted to physical persons .	postponed	9	Past
Many of the plays had already appeared in quarto versions — flimsy books made from sheets of paper folded twice to make four leaves .	folded	18	Past
$ 2 b - Estimated monthly cost of US military presence in Iraq projected by the White House in April 2003 .	projected	13	Past
This town is comprised of a large residential community that includes Fort Lee natives , transplants from New York , and immigrants , especially from Korea .	comprised	3	Past
The boy gasped , but then the yoyo stopped , dangling at the end of the line .	gasped	2	Past
Upon the same day he conquered Darius , won a great victory at sea , & died the same day .	conquered	5	Past
I have seen horses Loose Nails On there Own And do just fine with ONE nail gone Now if he had left out 2 or 3 I would be wondering to ...	Loose	4	Pres
He was In his 30s divorced and Had 2 kids .. but we both flirted Horribly with each other .. but neither one of us took the chance and Asked to other on a date . :(	Asked	29	Past
They worked around the clock to ensure that my puppy life was saved .	saved	12	Past
Steeped in culture and history , these islands are on the very edge of civilisation .	Steeped	0	Past
See the attached spreadsheet .	attached	2	Past
I am sending you a letter from their atty .	sending	2	Pres
About installing , licensing , and distributing Office Web Components	installing	1	Pres
We refer to licensed Fuel Cell Energy equipment .	licensed	3	Past
" When the characters reappear " , notes Rogers , " they do not step out of nowhere ;	notes	7	Pres
He also inspected my entie roof to see if there was anything else that needed attention .	inspected	2	Past
Among those who championed him were the writers Voltaire , Goethe , Stendhal and Victor Hugo .	championed	3	Past
It 's twice my size and eats a rabbit once a month .	eats	6	Pres
He was wounded at the Siege of Savannah on October 9 , 1779 .	wounded	2	Past
He served as minister of finance after the overthrow of the monarch after the 1958 Iraqi coup d'état for the government of General Abd al-Karim Qasim .	served	1	Past
I ordered 1000 postcards , we normally order 5000 or more .	ordered	1	Past
Rules in the room : # 1 ) if you drink the soda from the fridge in your room you must prove it by leaving the can in the trash .	drink	10	Pres
I am astonished .	astonished	2	Past
I went home at lunch to check on him and he is doing 1000 etter he was actually walkin around and wagin his tail :) thanks everbody for the info it s greatly appreciated .	walkin	18	Pres
A comparison of categories and sub-categories between both groups provides preliminary findings to support an emergent model , or models , of the “ transmedia fan ” .	provides	9	Pres
Since so much of the town ’s retail area is clustered in 3 or 4 block radius , it would be beneficial to walk around , but might also be dangerous given the high traffic intersections .	clustered	10	Past
For that reason the Commission believes that it is still too early to fix limit values for fuel quality for the year 2005 .	believes	5	Pres
( 30 ) One of the main roles of harmonised standards should be to help manufacturers in applying the implementing measures adopted under this Directive .	harmonised	9	Past
Estimates suggest 8000 migrants may be currently at sea in the region .	suggest	1	Pres
It varie$ company to company .	varie$	1	Pres
At the age of one , Harry had somehow survived a curse from the greatest dark sorcerer of all time , Lord Voldemort , whose name most witches and wizards still feared to speak .	feared	31	Past
The word ' ivory ' rang in the air , was whispered , was sighed .	whispered	11	Past
Installing the Office Web Components	Installing	0	Pres
Well Done !	Done	1	Past
He increasingly tuned his metaphors and images to the needs of the drama itself .	tuned	2	Past
Thomas Rymer , for example , condemned Shakespeare for mixing the comic with the tragic .	condemned	6	Past
I did n't understand what she 'd said except that they were visiting .	visiting	12	Pres
Climate : Humans fuss , animals adjust	adjust	6	Pres
Yes , but this time it is his carotid artery - the one that transports blood to the brain .	transports	14	Pres
Note that the No " Out " version requires us to pay the premium on Tuesday !	requires	8	Pres
The chicken should be " hypnotized " and cease to struggle .	hypnotized	5	Past
Access 2002 provides a PivotTable view for datasheets and forms .	provides	2	Pres
Harry also had a good comment --- do n't specify the amount of rate increase in our comments ; rather note that the rate increase needs to be well - reasoned and based on facts and evidence .	reasoned	30	Past
I enjoy going there although i 've only been there once , i will be returning toda to recieve a pair of french tips and i will only go to the best and to me the best is here .	enjoy	1	Pres
Your name will move up the list geometrically so that when your name reaches the # 1 position you will be receiving thousands of dollars in CASH !!!	reaches	13	Pres
However , what they hoped to do during the Tet Offensive was to sneak past the Americans and attack the ARVN in the urban areas where they were deployed doing successful Clear and Defend operations .	deployed	28	Past
Several candidates were assassinated and targeted these last two weeks , others have been forced under threats to withdraw and to follow the example of the Islamic party .	assassinated	3	Past
Well , T.V. is a series of flickering pictures that are streamed together to make a moving picture .	streamed	11	Past
Funny how some things are squirelled away by well - meaning prosecutors ...	squirelled	5	Past
There still is a very hot pursuit of the " Atta - level " Floridian , Adnan El Shukrijumah , who Siddiqui is thought to have known and been assisting .	assisting	29	Pres
We were introduced to Bistro Tallulah by traveler - professional diner who happens to own the Adelphi Hotel and travels the world -- and residing in Paris , London , New York the rest of the year .	introduced	2	Past
Attached please find the latest enovate risk policy .	Attached	0	Past
they do that whole thing where you sandwich the pepperoni between layers of cheese for + 32 delicious .	sandwich	7	Pres
Not with me , said Mr Malfoy , his long nostrils flaring .	flaring	11	Pres
Locked in the cupboard under the stairs , and I ca n't get out of this room –	Locked	0	Past
This enables you to seal the containers quickly after filling .	enables	1	Pres
To his right , ensconced behind the cash register , was the boss , a small balding man with curly hair and a concentration camp number tattoed on his forearm ,	ensconced	4	Past
He is delighted to be here , and he is suffering the one activates the other .	suffering	10	Pres
To truly make a glowstick without breaking an already-made glowstick and shoving its contents into a tube ( also known as cheating ) , you 've gotta let your inner scientist out ( along with a few dollars ) .	gotta	26	Past
On a recent event quote that I had done , they came in thousands of dollars over their local competition .	done	8	Past
The procedures for the exercise of these implementing powers conferred on the Commission were laid down afresh in the Council Decision of June 1999 .	implementing	7	Pres
Give yourself the gift of trying this place , to see if it fits you ...	fits	13	Pres
We live in the flicker – may it last as long as the old earth keeps rolling !	rolling	16	Pres
Their removal should also provide increased motivation for Pakistan to help the return of moderate Taliban .	increased	5	Past
The flowers were all that I hoped they would be , I have attended several funerals of late unfortunately and the flowers I recieved from Ana outshone them all .	outshone	26	Past
The ship offers variety of eatables , deliciously made .	offers	2	Pres
However , when he printed out the service quote , I could see that it was NOT the correct tire , and was not even an appropriate tire for my car model .	printed	4	Past
Andrei Sinyavsky , in his prison journal , concentrates on art .	concentrates	8	Pres
< Embedded Picture ( Device Independent Bitmap ) >	Embedded	1	Past
People goggled through the bars at him as he lay , starving and weak , on a bed of straw .	starving	11	Pres
I am very pleased with the tattoos that I revived from them .	revived	9	Past
I 'm looking to visit India with some mates at the beginning of February next year and I am wandering what standard of accommodation we could get for Rs 500 per person per night .	wandering	19	Pres
This little drip offered no apologies whatsoever , and even refused to give me the name of the manager until I pressed him for it 3 times .	pressed	21	Past
Finally , the " Hatfill theory " seems to have been exhausted or at least lost public favor .	exhausted	11	Past
Dudley stumbled backwards at once , a look of panic on his fat face .	stumbled	1	Past
Each time You distribute or publicly digitally perform a Derivative Work , Licensor offers to the recipient a license to the original Work on the same terms and conditions as the license granted to You under this License .	perform	7	Pres
Expressions such as " with bated breath " ( Merchant of Venice ) and " a foregone conclusion " ( Othello ) have found their way into everyday English speech .	foregone	16	Past
This , in turn , has discouraged international investment in Israel and has made it less likely that immigrants to the country will actually remain there .	discouraged	6	Past
Customizing the layout of a PivotChart view	Customizing	0	Pres
In this particular case since the counterparty is still not allowed to transact on EnronOnline almost a month after sending in their application they are understandably upset and are now complaining .	complaining	30	Pres
The IPN report examines commercial fish species , but it neglects important non-commercial animals , such as seals and polar bears .	examines	3	Pres
< Embedded Picture ( Device Independent Bitmap ) >	Embedded	1	Past
I formatted the file so that it would print on one legal size sheet .	formatted	1	Past
The Banks that Ate the Economy .	Ate	3	Past
Pan-democracy camp councillor Wu Chi-wai of the Democratic Party was elected .	elected	10	Past
Photographs from a seized computer disc included the controls and the locks on the door between the passengers and pilot .	seized	3	Past
$ 6.1 m - Amount the EPA historically valued each human life when conducting economic analyses of proposed regulations .	proposed	17	Past
One of the people assassinated very recently in Sri Lanka was Mr Kumar Ponnambalam , who had visited the European Parliament just a few months ago .	assassinated	4	Past
Opened in 2005 , Kopinga is the official meeting place of Te Imi Moriori .	Opened	0	Past
He estimated that there should be around 45 particles , but this number is very uncertain — I would n't be surprised if it is quite different from that .	estimated	1	Past
Ukraine , with its high - quality human capital and diversified economy , is a potentially attractive investment destination .	diversified	10	Past
He takes it apart , puts spells on it and puts it back together again .	puts	10	Pres
He exchanged dark looks with his wife , Petunia .	exchanged	1	Past
GCP procedure is to create Counterparty names that reflect either the Tradename / Division name or Parent Name -- not reflect both simultaneously .	reflect	20	Pres
The events of the last few years have amplified four issues , which have always existed , but have never been as rampant as in the present upheaval in the region .	existed	15	Past
Black rags were wound round their loins , and the short ends behind wagged to and fro like tails .	wagged	13	Past
As of today , we have not received payment in full as requested in Richard Sanders ' letter dated November 16 , 2000 .	dated	18	Past
She still has some sort of scholarship but I am not for sure how much it pays .	pays	16	Pres
When you copy an exterior line , the new line is located halfway between the line you copied and the nearest line parallel to the line you copied .	copied	17	Past
Th-thank you , said Harry , edging along the wall and sinking into his desk chair , next to Hedwig , who was asleep in her large cage .	edging	6	Pres
Afterwards , each ant was dipped in the solution for a couple of seconds , dried on a cloth and put in the nest .	dried	15	Past
On the one hand , it should pressure Musharraf to take off his uniform and run for president in a fair election , and to repeal the contentious " Legal Framework Order " that essentially perpetuates his dictatorship .	perpetuates	35	Pres
I told Paul that you called him yesterday so abruptly because you did n't want to waste his time while you got tests done for arthritis .	done	23	Past
This meant that he was constantly in danger of quickening his pace and crashing into Stillman from behind .	crashing	13	Pres
ANYWAY WE DRIVE AROUND IN MY VAN AND SOLVE MYSTERYS AND SHIT	SOLVE	8	Pres
Made an appointment to have them come to the house to discuss curtain options and give an estimate .	Made	0	Past
When I called the manager to complain , she said she KNEW the guy did n't know about curtains and that the usual lady called in sick hours earlier !	KNEW	11	Past
As a result , Tulsa breaks the Oklahoma stereotype of being nothing but a flat , arid dust bowl .	breaks	5	Pres
It is the marrying off of young girls to older men often close relatives that enfurates me .	enfurates	15	Pres
How are you making out on the revised version of the LOC ?	revised	7	Past
They 're currently on their honeymoon but shortly after returning will be moving from Buenos Aires to Miami , Florida .	moving	12	Pres
Why have a " minimum " if it is going to be ignored ?	ignored	12	Past
The plots of Shakespeare 's tragedies often hinge on such fatal errors or flaws , which overturn order and destroy the hero and those he loves .	destroy	19	Pres
In some parts of the city , numbered streets intersect , so the distinction is important .	intersect	9	Pres
The more radical Shiites , who generally follow the theocratic notions of Iran 's Ayatollah Ruhollah Khomeini , routinely chant and demonstrate against Israel .	follow	7	Pres
There was minimal cheese and sauce and it completely lacked flavor .	lacked	9	Past
i count like 14 explosive headlines .	count	1	Pres
Everyone knows you must be crazy to come of your own free will to one of these countries .	knows	1	Pres
It is heartening that the European Union recognises the problems and is willing to focus on them .	recognises	7	Pres
OVERALL DECENT BUT IF YOU ARE EXPECTING A RUTH CHRIS TYPE STEAK , THIS IS NOT IT .	EXPECTING	6	Pres
It takes only one bite from a disease - carrying mosquito to transmit a debilitating or deadly infection – and mosquitoes breed and multiply with astonishing speed .	breed	21	Pres
We hypothesized that the children , who were over the age of six at the time of collection , would have adult-like SI interpretations .	hypothesized	1	Past
Shrugging , he gives up and I turn to the twice disagreeable chicken and eat guiltily , my appetite spoiled .	spoiled	19	Past
It is interesting to observe that this nation is nicknamed " the Devil 's Island " .	nicknamed	9	Past
Quinn suspected that Stillman 's red notebook contained answers to the questions that had been accumulating in his mind , and he began to plot various stratagems for stealing it from the old man .	accumulating	15	Pres
What saves us is efficiency – the devotion to efficiency .	saves	1	Pres
We have no way to estimate how many times we 've served it overall , but we 're now pouring around ten a night .	pouring	19	Pres
Missile batteries arrayed in those mountains could raise bloody havoc with any fleet deployed below .	deployed	13	Past
Names of participants would be engraved , at their option , on a flag pole monument to be built in the nation 's capital , Wellington .	engraved	5	Past
Mike Day is fleshing out the legal details of our presentation and he will forward that along for folks review later today .	fleshing	3	Pres
Walls keeping water out of the bowl - shaped city have been breached , and emergency teams are using helicopters to drop 1,350 kg ( 3,000 lb ) sandbags and concrete barriers into the gaps .	breached	12	Past
On 29 June , however , a cannon set fire to the thatch of the Globe and burned the theatre to the ground , an event which pinpoints the date of a Shakespeare play with rare precision .	pinpoints	27	Pres
Based on how CRRA reacts , I would make an ultimate determination if the agreement needs to be attached to the LOI .	reacts	4	Pres
Example of aerated concrete , which provided a home for the subjects .	aerated	2	Past
Someone said , Watch out for the man from the CIA .	Watch	3	Pres
Yo mama `s so fat , instead of Levis 501 jeans , she wears Levi`s 1002`s .	wears	13	Pres
Judging by the fact that Draco Malfoy usually had the best of everything , his family were rolling in wizard gold ; he could just see Malfoy strutting around a large manor house .	Judging	0	Pres
It originated from the Latin word ' sonus ' meaning sound , and ' sonny ' a slang used by Americans to refer to a bright youngster .	originated	1	Past
It is accompanied by the further reflection ( partly proud , mostly bitter ) that we Jews seem to have a genius for finding the heart of the crisis .	finding	23	Pres
Here it is -- we printed this 2 - sided and laminated it .	laminated	11	Past
For a growth - starved US economy , the transformation of its codependent partner could well be a fork in the road .	starved	4	Past
I enjoyed your recent e-mail but was sorry to hear about your dad .	enjoyed	1	Past
To promote one of the most trivial interests we have , thousands of animals are tormented for their whole lives . "	tormented	15	Past
If Access does n't find a RefLibPaths key , it searches for the referenced file in the locations listed below in the following order :	searches	10	Pres
Changing the ANSI SQL query mode for the current database after you 've created one or more queries .	Changing	0	Pres
( 28 ) In respect of training and information on ecodesign for SMEs , it may be appropriate to consider accompanying activities .	accompanying	20	Pres
" Someone emailed me earlier today talking about a tool a group ’s been using to attack the scientology website .	emailed	2	Past
Who knows how much they want me to pay to fix this thing .	knows	1	Pres
They wandered here and there with their absurd long staves in their hands , like a lot of faithless pilgrims bewitched inside a rotten fence .	bewitched	20	Past
The committee voted to give NASA $ 16.4 billion in 2005 , about $ 200 million more than what the President requested and over $ 1 billion more than what House appropriators approved in July . "	voted	2	Past
I can tell you we were pleasantly surprised -- BT has taste memory and each time back the food was consistently delicious -- same dishes -- were consistent .	surprised	7	Past
My argument is it 's art and therefore should not be censored he 's making us censor it who 's right	censored	11	Past
The confidante and right - hand man of Dr. Ayman Zawahiri admitted that Zawahiri succeeded in obtaining anthrax and intended to use it against US targets .	succeeded	14	Past
The Escola do Cérebro is a platform that integrates seven digital games into a database .	integrates	8	Pres
When you copy an exterior line , the new line is located halfway between the line you copied and the nearest line parallel to the line you copied .	copied	27	Past
The Rock revolution happened in the Sixties ( 6 , number of the Beast ) .	happened	3	Past
Significantly , the individual who isolated it nearly a quarter century ago ( now retired ) , upon being contacted , does not even report that he necessarily sent the only copy of the strain to Ft. Detrick .	isolated	5	Past
If you carry out the Save As command after making changes to the object 's formatting , but before saving your changes , the current formatting – not the saved formatting – will be used to create the page .	saving	19	Pres
And , having only two days makes you realize what you have with your family .	makes	6	Pres
You may not offer or impose any terms on the Work that alter or restrict the terms of this License or the recipients ' exercise of the rights granted .	alter	12	Pres
We all know that John Kerry served in Vietnam .	served	6	Past
If I love cats so much , why are n't I DOING something ???	DOING	11	Pres
Here stands the biggest shopping mall of the island .	stands	1	Pres
Most versions in English are called The Chemical Wedding of Christian Rosencreutz , which suggests ( and most people who ’ve heard of it suppose ) that the wedding is Christian ’s .	suppose	24	Pres
It 's the water pumped into the tanks for ballast and then pumped out again that pollutes the seas , says John .	pumped	12	Past
Here and there bits of ancient Maya stonework can be seen reused in Spanish Colonial era buildings in the old part of town .	reused	11	Past
